{
  "extraction_record_id": "di-meo-2025-sema4a-low-bcma-v0",
  "date": "2026-04-14",
  "disease_program": "multiple-myeloma",
  "parent_map_id": "post-car-t-relapse-mechanism-map-v0",
  "source_ids": [
    "pubmed_di_meo_2025_sema4a_low_bcma"
  ],
  "taxonomy_class_ids": [
    "myeloma_class_car_t_cell_therapy"
  ],
  "mechanism_group_ids": [
    "bcma-antigen-loss-or-low-density-v0",
    "sequential-or-dual-target-immune-pressure-v0",
    "measurement-and-follow-up-gaps-v0"
  ],
  "clinical_use_boundary": "research-use-only",
  "source_record": {
    "source_type": "PubMed-indexed research article",
    "title": "Developing SEMA4A-directed CAR T cells to overcome low BCMA antigen density in multiple myeloma.",
    "url": "https://pubmed.ncbi.nlm.nih.gov/41072416/",
    "doi": "10.1016/j.ccell.2025.09.007",
    "pmid": "41072416",
    "accessed": "2026-04-14",
    "publication_year": 2025,
    "study_context": "Translational and preclinical target exploration after BCMA CAR T relapse with low BCMA antigen density; PubMed abstract and metadata used for this v0 public extraction."
  },
  "extracted_signals": [
    {
      "signal_id": "low-bcma-post-car-t-relapse-target-need-signal-v0",
      "mechanism_group_id": "bcma-antigen-loss-or-low-density-v0",
      "signal_summary": "The source frames relapse with low-to-negative BCMA expression after BCMA CAR T therapy as a reason to investigate additional targets.",
      "evidence_level": "mechanistic-preclinical",
      "direction": "supports",
      "measurement_fields": [
        "BCMA antigen density",
        "post-BCMA CAR T relapse state",
        "low-to-negative BCMA expression",
        "candidate alternate target need"
      ],
      "limitations": [
        "Does not estimate all low-BCMA relapse frequency from the public abstract alone.",
        "Low target density is not the only possible relapse mechanism.",
        "Clinical applicability requires trial and safety evidence."
      ]
    },
    {
      "signal_id": "sema4a-high-when-bcma-low-signal-v0",
      "mechanism_group_id": "sequential-or-dual-target-immune-pressure-v0",
      "signal_summary": "The source reports quantitative antigen-density profiling showing high SEMA4A molecules per cell where BCMA density is low in a post-BCMA CAR T relapse cohort.",
      "evidence_level": "mechanistic-preclinical",
      "direction": "supports",
      "measurement_fields": [
        "SEMA4A antigen density",
        "BCMA antigen density",
        "post-BCMA CAR T relapse cohort",
        "molecules per cell",
        "paired target-density comparison"
      ],
      "limitations": [
        "Candidate target density does not establish therapeutic efficacy.",
        "Requires full-methods review for cohort composition and assay details.",
        "Target expression in tumor cells must be weighed against normal-tissue safety."
      ]
    },
    {
      "signal_id": "sema4a-car-t-preclinical-activity-signal-v0",
      "mechanism_group_id": "sequential-or-dual-target-immune-pressure-v0",
      "signal_summary": "The source reports generation and screening of SEMA4A-directed CAR T constructs with preclinical activity against multiple myeloma models, including BCMA-low contexts.",
      "evidence_level": "mechanistic-preclinical",
      "direction": "supports",
      "measurement_fields": [
        "SEMA4A-directed CAR T construct",
        "engineered T-cell expansion",
        "cytokine release",
        "cytotoxicity",
        "patient-derived BCMA-low tumor model",
        "normal non-hematopoietic tissue reactivity screen"
      ],
      "limitations": [
        "Preclinical activity does not establish clinical benefit.",
        "Does not recommend SEMA4A-directed therapy.",
        "Phase 1 clinical readiness claims require trial registry and protocol review."
      ]
    },
    {
      "signal_id": "alternate-target-safety-fields-signal-v0",
      "mechanism_group_id": "measurement-and-follow-up-gaps-v0",
      "signal_summary": "The source highlights measurement fields needed for alternate-target work, including antigen density, normal-tissue reactivity, model context, and planned clinical translation.",
      "evidence_level": "mechanistic-preclinical",
      "direction": "supports",
      "measurement_fields": [
        "target expression on tumor cells",
        "target expression on normal tissues",
        "normal non-hematopoietic tissue reactivity",
        "model type",
        "clinical translation status"
      ],
      "limitations": [
        "Safety interpretation requires full preclinical package review and clinical protocol review.",
        "Public abstract does not provide a full safety dataset.",
        "Use only as extraction-field guidance."
      ]
    }
  ],
  "evidence_boundary": {
    "what_this_supports": [
      "Low BCMA antigen density belongs in the BCMA antigen escape extraction field set.",
      "Alternate-target strategies should capture target density, normal-tissue reactivity, model context, and clinical translation status.",
      "SEMA4A can be tracked as a candidate alternate-target research signal in post-BCMA relapse maps."
    ],
    "what_this_does_not_support": [
      "It does not prove SEMA4A-directed CAR T therapy works in patients.",
      "It does not recommend a SEMA4A-directed clinical trial.",
      "It does not establish that low BCMA density is present in all post-CAR T relapse.",
      "It does not replace safety, eligibility, or regulatory review."
    ]
  },
  "review": {
    "created": "2026-04-14",
    "last_reviewed": "2026-04-14",
    "review_status": "source-checked",
    "review_notes": [
      "Built from PubMed ESummary and EFetch metadata/abstract for PMID 41072416.",
      "Tracked as translational and preclinical signal extraction, not a clinical claim."
    ]
  }
}

