{
  "extraction_record_id": "tedder-bhutani-2025-bcma-resistance-review-v0",
  "date": "2026-04-14",
  "disease_program": "multiple-myeloma",
  "parent_map_id": "post-car-t-relapse-mechanism-map-v0",
  "source_ids": [
    "pubmed_tedder_bhutani_2025_bcma_resistance"
  ],
  "taxonomy_class_ids": [
    "myeloma_class_bispecific_antibody",
    "myeloma_class_car_t_cell_therapy"
  ],
  "mechanism_group_ids": [
    "bcma-antigen-loss-or-low-density-v0",
    "car-t-fitness-exhaustion-persistence-v0",
    "disease-burden-site-risk-context-v0",
    "sequential-or-dual-target-immune-pressure-v0",
    "measurement-and-follow-up-gaps-v0"
  ],
  "clinical_use_boundary": "research-use-only",
  "source_record": {
    "source_type": "PubMed-indexed review article",
    "title": "Resistance Mechanisms to BCMA Targeting Bispecific Antibodies and CAR T-Cell Therapies in Multiple Myeloma.",
    "url": "https://pubmed.ncbi.nlm.nih.gov/40710330/",
    "doi": "10.3390/cells14141077",
    "pmid": "40710330",
    "accessed": "2026-04-14",
    "publication_year": 2025,
    "study_context": "Review of BCMA-targeted CAR T-cell therapies and bispecific antibodies in relapsed/refractory multiple myeloma; PubMed abstract and metadata used for this v0 public extraction."
  },
  "extracted_signals": [
    {
      "signal_id": "multifactorial-bcma-resistance-categories-signal-v0",
      "mechanism_group_id": "measurement-and-follow-up-gaps-v0",
      "signal_summary": "The review frames BCMA-directed therapy resistance as multifactorial, including tumor-intrinsic, host-related, tumor-extrinsic, and tumor-microenvironment factors.",
      "evidence_level": "source-summary",
      "direction": "supports",
      "measurement_fields": [
        "tumor-intrinsic factors",
        "host-related factors",
        "tumor-extrinsic factors",
        "tumor microenvironment",
        "integrated immune profiling",
        "genomic profiling"
      ],
      "limitations": [
        "Review article; it does not provide a single quantitative extraction table in the public abstract.",
        "Mechanism categories require source-by-source extraction before scoring.",
        "Categories are not treatment recommendations."
      ]
    },
    {
      "signal_id": "sequencing-prior-bcma-exposure-signal-v0",
      "mechanism_group_id": "sequential-or-dual-target-immune-pressure-v0",
      "signal_summary": "The review identifies therapy sequencing and prior exposure to BCMA-targeted bispecific or CAR T-cell therapies as fields that may influence subsequent treatment efficacy.",
      "evidence_level": "source-summary",
      "direction": "supports",
      "measurement_fields": [
        "prior BCMA-targeted therapy class",
        "sequence of bispecific antibody and CAR T exposure",
        "subsequent response context",
        "duration after prior therapy",
        "resistance biology at next treatment"
      ],
      "limitations": [
        "Does not establish an optimal sequence.",
        "Subsequent treatment efficacy cannot be inferred from review framing alone.",
        "Requires trial-specific and product-specific extraction."
      ]
    },
    {
      "signal_id": "resistance-overcoming-strategies-catalog-signal-v0",
      "mechanism_group_id": "sequential-or-dual-target-immune-pressure-v0",
      "signal_summary": "The review names candidate strategies for overcoming resistance, including dual targeting, gamma-secretase inhibition, checkpoint blockade, armored CAR T constructs, and combinations.",
      "evidence_level": "source-summary",
      "direction": "supports",
      "measurement_fields": [
        "dual-targeting strategy",
        "gamma-secretase inhibitor strategy",
        "immune checkpoint blockade",
        "armored CAR T construct",
        "combination regimen",
        "mechanism matched by strategy"
      ],
      "limitations": [
        "Candidate strategy lists are not proof of clinical benefit.",
        "Each strategy requires separate evidence level, disease-state scope, and safety review.",
        "Do not use as a treatment recommendation."
      ]
    },
    {
      "signal_id": "durability-profiling-need-signal-v0",
      "mechanism_group_id": "measurement-and-follow-up-gaps-v0",
      "signal_summary": "The review emphasizes deeper resistance-biology understanding supported by immune and genomic profiling to optimize therapeutic durability.",
      "evidence_level": "source-summary",
      "direction": "supports",
      "measurement_fields": [
        "immune profiling",
        "genomic profiling",
        "durability endpoint",
        "relapse timing",
        "resistance category"
      ],
      "limitations": [
        "Profiling need does not specify a validated public minimum dataset.",
        "Durability optimization remains a research framing question.",
        "Needs expert review before being converted into a data-standard requirement."
      ]
    }
  ],
  "evidence_boundary": {
    "what_this_supports": [
      "The mechanism map should stay multi-bucket rather than reducing relapse to antigen loss alone.",
      "Public extraction records should include sequencing, immune profiling, genomic profiling, and microenvironment fields.",
      "Candidate overcoming strategies should be tracked as hypotheses until source-specific evidence supports stronger claims."
    ],
    "what_this_does_not_support": [
      "It does not prove any resistance-overcoming strategy improves survival.",
      "It does not rank CAR T-cell therapy versus bispecific antibodies.",
      "It does not recommend therapy sequencing.",
      "It does not establish a cure claim."
    ]
  },
  "review": {
    "created": "2026-04-14",
    "last_reviewed": "2026-04-14",
    "review_status": "source-checked",
    "review_notes": [
      "Built from PubMed ESummary and EFetch metadata/abstract for PMID 40710330.",
      "Use this extraction to guide fields and hypotheses, not mechanism frequency estimates."
    ]
  }
}

